{
  "name": "DataTypes",
  "uri": "http://datatypes",
  "prefix": "dt",
  "types": [
    {
      "name": "Root",
      "properties": [
        { "name": "bounds", "serialize": "xsi:type", "type": "Rect" },
        { "name": "otherBounds",
          "type": "do:Rect",
          "serialize": "xsi:type",
          "isMany": true
        },
        {
          "name": "defaultSingle",
          "type": "Boolean",
          "default": true
        }
      ]
    },
    {
      "name": "Rect",
      "properties": [
        { "name": "y", "type": "Integer", "isAttr": true }
      ]
    }
  ]
}
