{
  "name": "camunda",
  "prefix": "camunda",
  "uri": "http://camunda.org/schema/camunda/1.0",
  "xml": {
    "tagAlias": "lowerCase"
  },
  "associations": [],
  "types": [
    {
      "name": "TemplateSupported",
      "isAbstract": true,
      "extends": [
        "b:Root"
      ],
      "properties": [
        {
          "name": "modelerTemplate",
          "isAttr": true,
          "type": "String"
        }
      ]
    }
  ]
}
