{
  "name": "Replaces Extension",
  "uri": "http://replace-extension",
  "prefix": "e",
  "types": [
    {
      "name": "Base",
      "superClass": [
        "b:Base"
      ],
      "properties": [
        { "name": "value", "type": "String" },
        { "name": "id", "type": "Integer", "replaces": "b:Base#id", "isId": true }
      ]
    }
  ]
}