{
  "name": "Replaces Base",
  "uri": "http://replaces",
  "prefix": "b",
  "types": [
    {
      "name": "Base",
      "properties": [
        { "name": "id", "type": "Integer", "isId": true },
        { "name": "name", "type": "String" }
      ]
    },
    {
      "name": "Extension",
      "superClass": [ "Base" ],
      "properties": [
        { "name": "value", "type": "String" },
        { "name": "id", "type": "Integer", "replaces": "Base#id", "isId": true }
      ]
    }
  ]
}